<!ELEMENT students_info (student+)>
<!ELEMENT student (regno,name,avg,dob,mobileno,distinction)>
<!ELEMENT regno (#PCDATA)>
<!ELEMENT name (#PCDATA)>
<!ELEMENT avg (#PCDATA)>
<!ELEMENT dob (#PCDATA)>
<!ELEMENT mobileno (#PCDATA)>
<!ELEMENT distinction (#PCDATA)>