<?xml version="1.0" encoding="UTF-8"?>
<!DOCTYPE students_info SYSTEM "task2.dtd">
<students_info>
<student>         
   <regno>1900</regno>
   <name>Mukesh</name>    
   <avg>85</avg>
   <dob>09-05-1993</dob>         
    <mobileno>1234567890</mobileno>         
   <distinction>YES</distinction>
 </student>
 <student>         
   <regno>1900</regno>
   <name>Kushal</name>    
   <avg>92</avg>
   <dob>15-08-1992</dob>       
   <mobileno>1234567890</mobileno>         
   <distinction>YES</distinction>
 </student>
 <student>         
   <regno>1900</regno>
   <name>Nikhil</name>    
   <avg>81</avg>
   <dob>22-10-1991</dob>        
    <mobileno>1900</mobileno>         
   <distinction>YES</distinction>
 </student>
 <student>         
   <regno>1900</regno>
   <name>abhi</name>    
   <avg>98</avg>
   <dob>01-01-1994</dob>  
         
    <mobileno>1234567890</mobileno>          
   <distinction>YES</distinction>
 </student>
 <student>         
   <regno>1900</regno>
   <name>Hruthik</name>    
   <avg>90</avg>
   <dob>30-12-1992</dob>         
   <mobileno>1234567890</mobileno>         
   <distinction>YES</distinction>
 </student>
 
</students_info>