<?xml version="1.0" encoding="UTF-8"?>
<!DOCTYPE students_info SYSTEM "Task2.dtd">
<students_info>
<student>         
   <regno>170024</regno>
   <name>Naveen</name>    
   <avg>85</avg>
   <dob>09-05-1993</dob>         
    <mobileno>9849984901</mobileno>         
   <distinction>YES</distinction>
 </student>
 <student>         
   <regno>170025</regno>
   <name>sharooq</name>    
   <avg>92</avg>
   <dob>15-08-1992</dob>       
   <mobileno>9849984901</mobileno>         
   <distinction>YES</distinction>
 </student>
 <student>         
   <regno>170026</regno>
   <name>Sadiq</name>    
   <avg>81</avg>
   <dob>22-10-1991</dob>        
    <mobileno>9849984901</mobileno>         
   <distinction>YES</distinction>
 </student>
 <student>         
   <regno>170027</regno>
   <name>Surya</name>    
   <avg>98</avg>
   <dob>01-01-1994</dob>  
         
    <mobileno>9849984901</mobileno>          
   <distinction>YES</distinction>
 </student>
 <student>         
   <regno>170028</regno>
   <name>Ganesh</name>    
   <avg>90</avg>
   <dob>30-12-1992</dob>         
   <mobileno>9849984901</mobileno>         
   <distinction>YES</distinction>
 </student>
 
</students_info>